{
  "$schema": "https://json-schema.org/draft/2020-12/schema",
  "$id": "clodex/profile.schema.json",
  "title": "clodex repo profile",
  "description": "<repo>/.clodex/profile.json — the one clodex file a repository commits. Generated by the clodex router on first run from repo inspection plus a short interview, and updated non-destructively thereafter. It tells clodex how this repo builds, tests, versions, releases, and proves itself live, and which external actions clodex may propose here. Nullable fields are nullable on purpose: an explicit null (\"this repo has no changelog\") is a recorded fact, while an omitted field is an unanswered question.",
  "type": "object",
  "required": [
    "schema_version",
    "commands",
    "version",
    "branch",
    "tag",
    "changelog",
    "deploy",
    "evidence",
    "runtimes",
    "required_env",
    "actions"
  ],
  "additionalProperties": false,
  "properties": {
    "schema_version": {
      "type": "integer",
      "enum": [1],
      "description": "Profile contract version. 1 for clodex v0.1."
    },

    "bootstrap": {
      "type": "object",
      "description": "Optional bootstrap currency record. When present, all four fields describe the inspected repository and the clodex version used to derive it.",
      "required": ["clodex_version", "derived_at", "repo_fingerprint", "inspected"],
      "additionalProperties": false,
      "properties": {
        "clodex_version": {
          "type": "string",
          "description": "Semver MAJOR.MINOR.PATCH copied from skills/clodex/VERSION."
        },
        "derived_at": {
          "type": "string",
          "description": "Date the bootstrap record was derived, formatted YYYY-MM-DD."
        },
        "repo_fingerprint": {
          "type": "string",
          "description": "Repository fingerprint formatted sha256:<64 lowercase hex>."
        },
        "inspected": {
          "type": "array",
          "description": "The inspected marker records; each item has exactly marker, present, and value.",
          "items": {
            "type": "object",
            "required": ["marker", "present", "value"],
            "additionalProperties": false,
            "properties": {
              "marker": {
                "type": "string",
                "description": "The repository marker that was inspected."
              },
              "present": {
                "type": "boolean",
                "description": "Whether the marker was present."
              },
              "value": {
                "type": ["string", "null"],
                "description": "The marker's string value, or null for an existence marker."
              }
            }
          }
        }
      }
    },

    "commands": {
      "type": "object",
      "description": "Shell commands, run from the repo root. Every key is present; null means this repo genuinely has none. An omitted gate is silently skipped at verify, which is how offline-green runs hide real defects.",
      "required": ["install", "build", "test", "lint", "typecheck"],
      "additionalProperties": false,
      "properties": {
        "install": {"type": ["string", "null"], "description": "Dependency install, when a fresh checkout needs one before anything else runs."},
        "build": {"type": ["string", "null"]},
        "test": {"type": ["string", "null"]},
        "lint": {"type": ["string", "null"]},
        "typecheck": {"type": ["string", "null"]}
      }
    },

    "version": {
      "type": "object",
      "description": "Where the authoritative version lives. Ship reads this file at release time; it never trusts a version copied into the profile.",
      "required": ["source"],
      "additionalProperties": false,
      "properties": {
        "source": {
          "type": ["string", "null"],
          "description": "Repo-relative path holding the version, e.g. package.json, pyproject.toml, VERSION. Null when the repo is unversioned."
        },
        "field": {
          "type": ["string", "null"],
          "description": "Dotted key inside `source`, e.g. \"version\" or \"project.version\". Null when the whole file is the version string."
        },
        "bump_rule": {
          "type": ["string", "null"],
          "description": "How the next version is chosen (e.g. \"semver, minor for features\"). Guidance for the human decision, not an automation input."
        }
      }
    },

    "branch": {
      "type": "object",
      "required": ["default", "work_on_default"],
      "additionalProperties": false,
      "properties": {
        "default": {"type": "string", "description": "Integration branch, e.g. main."},
        "work_on_default": {
          "type": "boolean",
          "description": "True when a run may commit directly to the default branch. False when every run works on its own branch."
        },
        "naming": {
          "type": ["string", "null"],
          "description": "Pattern for run branches when work_on_default is false, e.g. \"clodex/<run-id>\"."
        }
      }
    },

    "tag": {
      "type": "object",
      "required": ["enabled", "format"],
      "additionalProperties": false,
      "properties": {
        "enabled": {"type": "boolean", "description": "False when this repo does not tag releases."},
        "format": {
          "type": ["string", "null"],
          "description": "Tag pattern, e.g. \"v{version}\". Null when enabled is false."
        }
      }
    },

    "changelog": {
      "type": ["object", "null"],
      "description": "Null when this repo keeps no changelog.",
      "required": ["path"],
      "additionalProperties": false,
      "properties": {
        "path": {"type": "string", "description": "Repo-relative file, or the directory releases are written into."},
        "style": {"type": ["string", "null"], "description": "House convention, e.g. \"keep-a-changelog\" or \"one file per release\"."}
      }
    },

    "docs": {
      "type": "object",
      "description": "Where clodex reads context from and writes plans to.",
      "additionalProperties": false,
      "properties": {
        "architecture": {
          "type": "array",
          "items": {"type": "string"},
          "description": "Repo-relative docs a plan must be grounded in before proposing structure."
        },
        "plans_dir": {
          "type": ["string", "null"],
          "description": "Where clodex-plan writes plan files, e.g. \"docs/plans\"."
        }
      }
    },

    "deploy": {
      "type": ["object", "null"],
      "description": "Null when this repo does not deploy — ship then closes at the explicit not-deployed boundary instead of guessing.",
      "required": ["target", "trigger", "verify_live"],
      "additionalProperties": false,
      "properties": {
        "target": {"type": "string", "description": "Where a release lands, e.g. \"Vercel project <name>, production\"."},
        "trigger": {
          "type": "string",
          "enum": ["auto-on-push", "manual-command", "external"],
          "description": "How a deploy starts. manual-command means an entry in `actions` performs it; external means a person or system outside clodex does."
        },
        "verify_live": {
          "type": "array",
          "description": "Checks that prove the new release is actually serving. Empty means live state cannot be verified here — ship must record that boundary rather than assume success.",
          "items": {
            "type": "object",
            "required": ["name", "check"],
            "additionalProperties": false,
            "properties": {
              "name": {"type": "string"},
              "check": {"type": "string", "description": "Shell command that exits 0 only when the new release is live."}
            }
          }
        }
      }
    },

    "release_owner": {
      "type": "string",
      "enum": ["run", "external"],
      "description": "Who owns the release machinery. Optional; omitted means \"run\" — the run itself books, commits, tags, pushes, deploys per this profile. \"external\" declares the orchestrated-lane shape: the run's deliverable is a reviewed branch plus a handoff artifact, release actions belong to an external orchestrator, and ship's terminal state for a fully successful lane is `handed-off`, not `abandoned`. Deliberately not part of schema_version 1's required set: an old install that never reads this key behaves exactly as today."
    },

    "evidence": {
      "type": "object",
      "description": "What proof this repo expects by default. A plan may declare more; declaring less is an argued exception, recorded in the plan.",
      "required": ["default_classes"],
      "additionalProperties": false,
      "properties": {
        "default_classes": {
          "type": "array",
          "items": {"type": "string", "enum": ["tests", "real-data", "live-check", "visual", "client-artifact"]},
          "description": "tests = automated suites · real-data = run against production-shaped input · live-check = the deployed thing observed working · visual = rendered output reviewed · client-artifact = the artifact a client receives, read from their side."
        }
      }
    },

    "runtimes": {
      "type": "array",
      "description": "Checked by preflight before any stage runs, so a missing toolchain fails in seconds rather than mid-build. Required: an omitted list turns that check into a permanent no-op, so a repo with nothing to check says so with []. Derive entries from package.json engines, .nvmrc, .tool-versions, or pyproject.toml requires-python rather than asking.",
      "items": {
        "type": "object",
        "required": ["name", "command"],
        "additionalProperties": false,
        "properties": {
          "name": {"type": "string", "description": "e.g. node, python, pnpm."},
          "command": {"type": "string", "description": "Executable preflight probes with `command -v`."},
          "min_version": {"type": ["string", "null"]},
          "version_command": {"type": ["string", "null"], "description": "Command that prints the version, required when min_version is set."}
        }
      }
    },

    "required_env": {
      "type": "array",
      "items": {"type": "string"},
      "description": "Credential and configuration variable NAMES this repo's commands need. Names only — never values. Preflight checks each is set with `printenv <NAME> >/dev/null` and never prints it. Required for the same reason as runtimes: a repo that needs none says so with []."
    },

    "actions": {
      "type": "array",
      "description": "The structured action policy: the exact release and deploy actions clodex may propose in this repo. Nothing outside this list may be run at ship — a new action is added here and committed first.",
      "items": {
        "type": "object",
        "required": ["id", "argv", "policy"],
        "additionalProperties": false,
        "properties": {
          "id": {
            "type": "string",
            "pattern": "^[a-z0-9][a-z0-9-]*$",
            "description": "Stable identifier referenced by a release authorization, e.g. push-main."
          },
          "argv": {
            "type": "array",
            "minItems": 1,
            "items": {"type": "string"},
            "description": "Literal argv, never a shell string. {braced} placeholders are filled from run state (e.g. {version}, {tag}); the filled argv is what gets shown for approval and what gets run."
          },
          "cwd": {"type": ["string", "null"], "description": "Repo-relative working directory; null means the repo root."},
          "target": {"type": ["string", "null"], "description": "What this action affects, e.g. \"origin/main\"."},
          "env_refs": {
            "type": "array",
            "items": {"type": "string"},
            "description": "Credential NAMES this action needs. Names only."
          },
          "policy": {
            "type": "string",
            "enum": ["auto-with-authorization", "always-ask-exact"],
            "description": "auto-with-authorization: may run once the single consolidated release authorization at ship covers it. always-ask-exact: the literal filled argv is presented for approval every time it runs, in every run — for destructive or irreversible actions, and for repos with their own guardrail tiers."
          }
        }
      }
    },

    "notes": {
      "type": ["string", "null"],
      "description": "Free-form context for humans. Nothing in clodex reads this field. Anything that must change what clodex does belongs in a typed field above."
    }
  }
}
